Liquidator,Bank Name,Legal Address,Contacts,Document regarding the appointment as Liquidator,Bank Information,Date information
Silvia Marcu,B.C. ”Universalbank” S.A.,"mun. Chișinău str. Mitropolit G. Bănulescu Bodoni, 45",tel: (+373) 22 859-700,NBM Order  no.09-02118/7 of 17.08.2012,Liquidators of banks in process of liquidation,09.07.2019
Iulian Țurcan,BC „UNIBANK” S.A.,"mun. Chișinău str. Mitropolit G. Bănulescu Bodoni, 45",tel: (+373) 22 253-801,NBM Order  no.09-02118/4 of 03.12.2015,Liquidators of banks in process of liquidation,09.07.2019
Iulian Țurcan,BC „BANCA SOCIALĂ” S.A.,"mun. Chișinău str. Mitropolit G. Bănulescu Bodoni, 45",tel: (+373) 22 253-801,NBM Order  no. 23-01009/6 of 27.11.2018,Liquidators of banks in process of liquidation,09.07.2019
Grigore Olaru,Banca de Economii S.A.,"mun. Chișinău, str. Mircea cel Bătrîn, 23",Antechamber: 067218008 Services and social payments section: (+373) 22 231-396,NBM Order  no.09-02118/1 of 16.10.2015,Liquidators of banks in process of liquidation,09.07.2019
Grigore Olaru,BC „Investprivatbank” S.A.,"mun. Chișinău, str. Mircea cel Bătrîn, 23",Antechamber: 067218089,NBM Order  no.23-01009/2 of 22.06.2017,Liquidators of banks in process of liquidation,09.07.2019
